{
  "all_checks_passed": true,
  "bitcoin_core_regtest_all_passed": false,
  "bitcoin_core_regtest_executed": true,
  "checks": {
    "core/CORE-001: passed status is backed by real commands": true,
    "core/CORE-001: stderr log at core-matrix-bitcoind-version.20260816T041833575774Z.stderr.log matches recorded hash": true,
    "core/CORE-001: stdout log at core-matrix-bitcoind-version.20260816T041833575774Z.stdout.log matches recorded hash": true,
    "core/CORE-002: passed status is backed by real commands": true,
    "core/CORE-002: stderr log at core-matrix-bitcoind-version.20260816T041833575774Z.stderr.log matches recorded hash": true,
    "core/CORE-002: stdout log at core-matrix-bitcoind-version.20260816T041833575774Z.stdout.log matches recorded hash": true,
    "core/CORE-003: passed status is backed by real commands": true,
    "core/CORE-003: stderr log at core-matrix-bitcoind-version.20260816T041833575774Z.stderr.log matches recorded hash": true,
    "core/CORE-003: stdout log at core-matrix-bitcoind-version.20260816T041833575774Z.stdout.log matches recorded hash": true,
    "core/CORE-004: passed status is backed by real commands": true,
    "core/CORE-004: stderr log at core-matrix-bitcoind-version.20260816T041833575774Z.stderr.log matches recorded hash": true,
    "core/CORE-004: stdout log at core-matrix-bitcoind-version.20260816T041833575774Z.stdout.log matches recorded hash": true,
    "core/CORE-006: passed status is backed by real commands": true,
    "core/CORE-006: stderr log at core-matrix-bitcoind-version.20260816T041833575774Z.stderr.log matches recorded hash": true,
    "core/CORE-006: stdout log at core-matrix-bitcoind-version.20260816T041833575774Z.stdout.log matches recorded hash": true,
    "core/CORE-007: passed status is backed by real commands": true,
    "core/CORE-007: stderr log at core-matrix-bitcoind-version.20260816T041833575774Z.stderr.log matches recorded hash": true,
    "core/CORE-007: stdout log at core-matrix-bitcoind-version.20260816T041833575774Z.stdout.log matches recorded hash": true,
    "core/CORE-012: passed status is backed by real commands": true,
    "core/CORE-012: stderr log at core-matrix-bitcoind-version.20260816T041833575774Z.stderr.log matches recorded hash": true,
    "core/CORE-012: stdout log at core-matrix-bitcoind-version.20260816T041833575774Z.stdout.log matches recorded hash": true,
    "core/CORE-013: passed status is backed by real commands": true,
    "core/CORE-013: stderr log at core-matrix-bitcoind-version.20260816T041833575774Z.stderr.log matches recorded hash": true,
    "core/CORE-013: stdout log at core-matrix-bitcoind-version.20260816T041833575774Z.stdout.log matches recorded hash": true,
    "core/CORE-014: passed status is backed by real commands": true,
    "core/CORE-014: stderr log at durability-test_durable_slot_ledger.20260816T041857279343Z.stderr.log matches recorded hash": true,
    "core/CORE-014: stdout log at durability-test_durable_slot_ledger.20260816T041857279343Z.stdout.log matches recorded hash": true,
    "core/CORE-015: passed status is backed by real commands": true,
    "core/CORE-015: stderr log at core-matrix-bitcoind-version.20260816T041833575774Z.stderr.log matches recorded hash": true,
    "core/CORE-015: stdout log at core-matrix-bitcoind-version.20260816T041833575774Z.stdout.log matches recorded hash": true,
    "core/CORE-016: passed status is backed by real commands": true,
    "core/CORE-016: stderr log at durability-test_crash_durability.20260816T041858002267Z.stderr.log matches recorded hash": true,
    "core/CORE-016: stdout log at durability-test_crash_durability.20260816T041858002267Z.stdout.log matches recorded hash": true,
    "core/CORE-017: passed status is backed by real commands": true,
    "core/CORE-017: stderr log at durability-test_crash_durability.20260816T041858002267Z.stderr.log matches recorded hash": true,
    "core/CORE-017: stdout log at durability-test_crash_durability.20260816T041858002267Z.stdout.log matches recorded hash": true,
    "core/CORE-019: passed status is backed by real commands": true,
    "core/CORE-019: stderr log at core-matrix-bitcoind-version.20260816T041833575774Z.stderr.log matches recorded hash": true,
    "core/CORE-019: stdout log at core-matrix-bitcoind-version.20260816T041833575774Z.stdout.log matches recorded hash": true,
    "core/CORE-024: passed status is backed by real commands": true,
    "core/CORE-024: stderr log at core-matrix-bitcoind-version.20260816T041833575774Z.stderr.log matches recorded hash": true,
    "core/CORE-024: stdout log at core-matrix-bitcoind-version.20260816T041833575774Z.stdout.log matches recorded hash": true,
    "core/CORE-025: passed status is backed by real commands": true,
    "core/CORE-025: stderr log at core-matrix-bitcoind-version.20260816T041833575774Z.stderr.log matches recorded hash": true,
    "core/CORE-025: stdout log at core-matrix-bitcoind-version.20260816T041833575774Z.stdout.log matches recorded hash": true,
    "core/CORE-028: passed status is backed by real commands": true,
    "core/CORE-028: stderr log at core-matrix-bitcoind-version.20260816T041833575774Z.stderr.log matches recorded hash": true,
    "core/CORE-028: stdout log at core-matrix-bitcoind-version.20260816T041833575774Z.stdout.log matches recorded hash": true,
    "core/CORE-029: passed status is backed by real commands": true,
    "core/CORE-029: stderr log at core-matrix-bitcoind-version.20260816T041833575774Z.stderr.log matches recorded hash": true,
    "core/CORE-029: stdout log at core-matrix-bitcoind-version.20260816T041833575774Z.stdout.log matches recorded hash": true,
    "core/CORE-030: passed status is backed by real commands": true,
    "core/CORE-030: stderr log at core-matrix-bitcoind-version.20260816T041833575774Z.stderr.log matches recorded hash": true,
    "core/CORE-030: stdout log at core-matrix-bitcoind-version.20260816T041833575774Z.stdout.log matches recorded hash": true,
    "strata_build/STRATA-001: passed status is backed by real commands": true,
    "strata_build/STRATA-001: stderr log at strata-head.20260816T071059928017Z.stderr.log matches recorded hash": true,
    "strata_build/STRATA-001: stdout log at strata-head.20260816T071059928017Z.stdout.log matches recorded hash": true,
    "strata_build/STRATA-002: passed status is backed by real commands": true,
    "strata_build/STRATA-002: stderr log at strata-preflight.20260816T071059979567Z.stderr.log matches recorded hash": true,
    "strata_build/STRATA-002: stdout log at strata-preflight.20260816T071059979567Z.stdout.log matches recorded hash": true,
    "strata_build/STRATA-003: passed status is backed by real commands": true,
    "strata_build/STRATA-003: stderr log at strata-scope.20260816T071100771964Z.stderr.log matches recorded hash": true,
    "strata_build/STRATA-003: stdout log at strata-scope.20260816T071100771964Z.stdout.log matches recorded hash": true,
    "strata_build/STRATA-004: passed status is backed by real commands": true,
    "strata_build/STRATA-004: stderr log at strata-fmt.20260816T071100816733Z.stderr.log matches recorded hash": true,
    "strata_build/STRATA-004: stdout log at strata-fmt.20260816T071100816733Z.stdout.log matches recorded hash": true,
    "strata_build/STRATA-005: passed status is backed by real commands": true,
    "strata_build/STRATA-005: stderr log at strata-strata-005.20260816T071101325963Z.stderr.log matches recorded hash": true,
    "strata_build/STRATA-005: stdout log at strata-strata-005.20260816T071101325963Z.stdout.log matches recorded hash": true,
    "strata_build/STRATA-006: passed status is backed by real commands": true,
    "strata_build/STRATA-006: stderr log at strata-strata-006.20260816T071245654172Z.stderr.log matches recorded hash": true,
    "strata_build/STRATA-006: stdout log at strata-strata-006.20260816T071245654172Z.stdout.log matches recorded hash": true,
    "strata_build/STRATA-007: passed status is backed by real commands": true,
    "strata_build/STRATA-007: stderr log at strata-strata-007.20260816T071406054906Z.stderr.log matches recorded hash": true,
    "strata_build/STRATA-007: stdout log at strata-strata-007.20260816T071406054906Z.stdout.log matches recorded hash": true,
    "strata_build/STRATA-008: passed status is backed by real commands": true,
    "strata_build/STRATA-008: stderr log at strata-strata-008.20260816T071541091357Z.stderr.log matches recorded hash": true,
    "strata_build/STRATA-008: stdout log at strata-strata-008.20260816T071541091357Z.stdout.log matches recorded hash": true,
    "strata_build/STRATA-009: stderr log at strata-strata-009.20260816T071637473426Z.stderr.log matches recorded hash": true,
    "strata_build/STRATA-009: stdout log at strata-strata-009.20260816T071637473426Z.stdout.log matches recorded hash": true
  },
  "core_matrix": {
    "all_passed": false,
    "any_failed": false,
    "cases": {
      "CORE-001": {
        "blocked_by": null,
        "case_id": "CORE-001",
        "commands": [
          {
            "argv": [
              "/tmp/core311/bitcoin-31.1/bin/bitcoind",
              "--version"
            ],
            "cwd": "/Users/cdjk/Downloads/ranklock-v0.25.2-claude-handoff/work/ranklock-v0.25.1",
            "duration_ms": 6,
            "env_digest": "9ac864309bcf14459523fdd45782bc8dd2c2b4c03d334b640da8259be7be821b",
            "exit_code": 0,
            "finished_at_utc": "2026-08-16T04:18:33.582480Z",
            "schema": "ranklock-v0252-command-record-v1",
            "started_at_utc": "2026-08-16T04:18:33.576039Z",
            "stderr_path": "results/v0252_logs/core-matrix-bitcoind-version.20260816T041833575774Z.stderr.log",
            "stderr_sha256": "e3b0c44298fc1c149afbf4c8996fb92427ae41e4649b934ca495991b7852b855",
            "stdout_path": "results/v0252_logs/core-matrix-bitcoind-version.20260816T041833575774Z.stdout.log",